{
  "$schema": "https://openpresentation.org/schema/opf-chart-type/v1",
  "id": "clustered-bar-2x",
  "name": "CLUSTERED_BAR_2X",
  "label": "Clustered Bar 2x",
  "mappings": {
    "openxml": {
      "element": "barChart",
      "barDir": "bar",
      "grouping": "clustered",
      "composition": "single"
    }
  },
  "categories": 6,
  "columns": [
    "Series 1",
    "Value 1",
    "Value 2"
  ],
  "group": "Bar",
  "groupSort": 4,
  "series": 2,
  "seriesGroups": 1,
  "slideNumber": 22,
  "useSecondaryCategories": false,
  "workbookRange": "Sheet1!$A$1:$G$3",
  "complexity": "simple",
  "dataColumns": [
    {
      "name": "Series 1",
      "role": "categoryLabel",
      "type": "string",
      "position": "row0_col0"
    },
    {
      "name": "Value 1",
      "role": "series",
      "type": "number",
      "position": "row1_col0"
    },
    {
      "name": "Value 2",
      "role": "series",
      "type": "number",
      "position": "row2_col0"
    }
  ],
  "sampleData": {
    "headers": [
      "Series 1",
      "Q1 2024",
      "Q2 2024",
      "Q3 2024",
      "Q4 2024",
      "Q1 2025",
      "Q2 2025"
    ],
    "rows": [
      [
        "Value 1",
        33509,
        53540,
        63964,
        97806,
        42527,
        44970
      ],
      [
        "Value 2",
        30866,
        24168,
        60140,
        15075,
        71694,
        39154
      ]
    ]
  },
  "preview": {
    "src": "https://xano.storyd.ai/vault/PMfrMmjB/viG7BYoUT5gsQJhIm-bn9Y_i2qg/9XZXVQ../022_CLUSTERED_BAR_2X.png",
    "vectorSrc": "https://xano.storyd.ai/vault/PMfrMmjB/Ka9wY_seyJ0JOP73E39i9p4Og5w/TK9U7g../022_CLUSTERED_BAR_2X.svg"
  }
}
