{
  "$schema": "https://openpresentation.org/schema/opf-chart-type/v1",
  "id": "stacked-area-2x",
  "name": "STACKED_AREA_2X",
  "label": "Stacked Area 2x",
  "mappings": {
    "openxml": {
      "element": "areaChart",
      "grouping": "stacked",
      "composition": "single"
    }
  },
  "categories": 12,
  "columns": [
    "Series 1",
    "Value 1",
    "Value 2"
  ],
  "group": "Area",
  "groupSort": 5,
  "series": 2,
  "seriesGroups": 1,
  "slideNumber": 29,
  "useSecondaryCategories": false,
  "workbookRange": "Sheet1!$A$1:$M$3",
  "complexity": "simple",
  "dataColumns": [
    {
      "name": "Series 1",
      "role": "categoryLabel",
      "type": "string",
      "position": "row0_col0"
    },
    {
      "name": "Value 1",
      "role": "series",
      "type": "number",
      "position": "row1_col0"
    },
    {
      "name": "Value 2",
      "role": "series",
      "type": "number",
      "position": "row2_col0"
    }
  ],
  "sampleData": {
    "headers": [
      "Series 1",
      "Q1 2024",
      "Q2 2024",
      "Q3 2024",
      "Q4 2024",
      "Q1 2025",
      "Q2 2025",
      "Q3 2025",
      "Q4 2025",
      "Q1 2026",
      "Q2 2026",
      "Q3 2026",
      "Q4 2026"
    ],
    "rows": [
      [
        "Value 1",
        95813,
        52237,
        70946,
        67905,
        67954,
        98555,
        38010,
        77000,
        72021,
        32241,
        96356,
        21114
      ],
      [
        "Value 2",
        47196,
        77561,
        97012,
        92960,
        91167,
        53933,
        22240,
        40784,
        98184,
        50687,
        39444,
        36100
      ]
    ]
  },
  "preview": {
    "src": "https://xano.storyd.ai/vault/PMfrMmjB/ovVdan7TnXp4IwpArsLoFc7yolI/861z0A../029_STACKED_AREA_2X.png",
    "vectorSrc": "https://xano.storyd.ai/vault/PMfrMmjB/ZXV3MIMEx0CMNYthV4xTfc7NFtA/lauR8g../029_STACKED_AREA_2X.svg"
  }
}
