{
  "$schema": "https://openpresentation.org/schema/opf-chart-type/v1",
  "id": "filled-radar",
  "name": "FILLED_RADAR",
  "label": "Filled Radar",
  "mappings": {
    "openxml": {
      "element": "radarChart",
      "radarStyle": "filled",
      "composition": "single"
    }
  },
  "categories": 8,
  "columns": [
    "Series 1",
    "Value"
  ],
  "group": "Radar",
  "groupSort": 7,
  "series": 1,
  "seriesGroups": 1,
  "slideNumber": 42,
  "useSecondaryCategories": false,
  "workbookRange": "Sheet1!$A$1:$I$2",
  "complexity": "simple",
  "dataColumns": [
    {
      "name": "Series 1",
      "role": "categoryLabel",
      "type": "string",
      "position": "row0_col0"
    },
    {
      "name": "Value",
      "role": "series",
      "type": "number",
      "position": "row1_col0"
    }
  ],
  "sampleData": {
    "headers": [
      "Series 1",
      "Q1 2024",
      "Q2 2024",
      "Q3 2024",
      "Q4 2024",
      "Q1 2025",
      "Q2 2025",
      "Q3 2025",
      "Q4 2025"
    ],
    "rows": [
      [
        "Value",
        85631,
        92502,
        99974,
        17026,
        29887,
        29555,
        83772,
        49824
      ]
    ]
  },
  "preview": {
    "src": "https://xano.storyd.ai/vault/PMfrMmjB/wzo23rIEgJeCgr62WQyoCqHWc1g/fY_ilw../042_FILLED_RADAR.png",
    "vectorSrc": "https://xano.storyd.ai/vault/PMfrMmjB/EOTtjzPmnEFd-e3aVVzPi8uH62U/z8TIvQ../042_FILLED_RADAR.svg"
  }
}
