{
  "$schema": "https://openpresentation.org/schema/opf-chart-type/v1",
  "id": "australia",
  "name": "AUSTRALIA",
  "label": "Australia",
  "mappings": {
    "openxml": {
      "element": "mapChart",
      "composition": "extension",
      "notes": "Office extension chart; exact extension markup is renderer-specific."
    }
  },
  "categories": 8,
  "columns": [
    "State/Territory",
    "Value"
  ],
  "group": "Map",
  "groupSort": 12,
  "series": 1,
  "seriesGroups": 1,
  "slideNumber": 70,
  "useSecondaryCategories": false,
  "workbookRange": "Sheet1!$A$1:$I$2",
  "complexity": "simple",
  "dataColumns": [
    {
      "name": "State/Territory",
      "role": "categoryLabel",
      "type": "string",
      "position": "row0_col0"
    },
    {
      "name": "Value",
      "role": "series",
      "type": "number",
      "position": "row1_col0"
    }
  ],
  "sampleData": {
    "headers": [
      "State/Territory",
      "Q1 2024",
      "Q2 2024",
      "Q3 2024",
      "Q4 2024",
      "Q1 2025",
      "Q2 2025",
      "Q3 2025",
      "Q4 2025"
    ],
    "rows": [
      [
        "Value",
        83889,
        85952,
        68838,
        99277,
        83989,
        94278,
        93269,
        91857
      ]
    ]
  },
  "preview": {
    "src": "https://xano.storyd.ai/vault/PMfrMmjB/fVNzL-An9e8lBwwyXrR0Rk1YItg/mn3fXw../070_AUSTRALIA.png",
    "vectorSrc": "https://xano.storyd.ai/vault/PMfrMmjB/heTZpGmHD6vCkhmhS-UArixaIvI/iA7gew../070_AUSTRALIA.svg"
  }
}
